{
  "extends": "client-error",
  "layout": "centered illustration",
  "copyTitle": "Short Human-Readable Title",
  "copyMessageKey": "category.subcode",
  "illustration": "describe illustration here",
  "cta": "Action label",
  "patterns": {
    "fullPage": {
      "description": "When to use the full-page variant",
      "usage": "Describe the use case"
    }
  },
  "figmaNote": "Duplicate this component → variants for light/dark + RTL.",
  "designSystemIntegrations": {
    "tailwind": "class=\"flex flex-col items-center gap-6 text-slate-700 bg-white p-10 rounded-3xl shadow-sm\"",
    "shadcn": "<Alert variant=\"default\"><AlertTitle>{title}</AlertTitle><AlertDescription>{t(messageKey)}</AlertDescription></Alert>",
    "material": "<Alert severity=\"info\">{t(messageKey)}</Alert>",
    "ant": "<Alert message={title} description={t(messageKey)} type=\"info\" showIcon />"
  }
}
