{
    "extends": "server-error",
    "layout": "centered illustration",
    "copyTitle": "Down for Maintenance",
    "copyMessageKey": "server.unavailable",
    "illustration": "tools / hard hat icon",
    "cta": "Check status page",
    "patterns": {
        "fullPage": { "description": "Full maintenance page", "usage": "Planned downtime windows" }
    },
    "figmaNote": "Use warm/calm color palette — this is expected, not alarming.",
    "designSystemIntegrations": {
        "tailwind": "class=\"flex flex-col items-center gap-6 text-slate-700 bg-white p-10 rounded-3xl shadow-sm\"",
        "shadcn": "<Alert variant=\"default\"><AlertTitle>Down for Maintenance</AlertTitle><AlertDescription>{t('server.unavailable')}</AlertDescription></Alert>",
        "material": "<Alert severity=\"warning\">{t('server.unavailable')}</Alert>",
        "ant": "<Alert message=\"Down for Maintenance\" description={t('server.unavailable')} type=\"warning\" showIcon />"
    }
}
