{
    "extends": "client-error",
    "layout": "centered illustration",
    "copyTitle": "No Longer Available",
    "copyMessageKey": "resource.deleted",
    "illustration": "tombstone or empty box icon",
    "cta": "Go back",
    "patterns": {
        "fullPage": { "description": "Full-page 410 error", "usage": "Deleted posts, expired links" }
    },
    "figmaNote": "Distinct from 404 — use 'deleted' not 'missing' iconography.",
    "designSystemIntegrations": {
        "tailwind": "class=\"flex flex-col items-center gap-6 text-slate-700 bg-white p-10 rounded-3xl shadow-sm\"",
        "shadcn": "<Alert variant=\"default\"><AlertTitle>No Longer Available</AlertTitle><AlertDescription>{t('resource.deleted')}</AlertDescription></Alert>",
        "material": "<Alert severity=\"info\">{t('resource.deleted')}</Alert>",
        "ant": "<Alert message=\"No Longer Available\" description={t('resource.deleted')} type=\"info\" showIcon />"
    }
}
